{
  "summary": "Brandyn executed brand_identity_governance as brand_brain.",
  "actions": [
    "Define proof-led positioning for the Z Best Media launch page.",
    "Approve messaging pillars and tone guardrails for customer-facing copy.",
    "Handoff the approved direction to Jordyn for visual system alignment."
  ],
  "risks": [
    "Denied capabilities: posting.direct_outbound, visual.identity_override, budget.modify",
    "Cross-domain work requires explicit approval before leaving brand identity governance."
  ],
  "approvalRequired": false,
  "handoffTarget": "jordyn",
  "evidence": [
    "memoryCollections=approved_taglines, messaging_pillars, tone_decisions",
    "evalMetrics=tone_fidelity, positioning_consistency, contradiction_rate, banned_phrase_violations, offer_clarity"
  ]
}
